FILE|TITLE|TYPE|AUTHOR|TERM|YEAR
WithycombeJennyLind.pdf|“sometimes we are smart and athletic”: a qualitative investigation of the social construction and psychological impact of media representations on african american intercollegiate female athletes|dissertation|jenny lind withycombe|may|2009
WoldruffRyanD.pdf|of rain, a river|thesis|ryan dean woldruff|may|2009
WrushenBarbaraRivers.pdf|elementary principals’ and special education teachers’ understanding and implementation of inclusive practices: are their espoused beliefs evident in practice?|dissertation|barbara rivers wrushen|may|2009
XuJun.pdf|the development and evaluation of a detection concept to extend the red clearance by predicting a red light running event|thesis|jun xu|may|2009
YarkovichJosephGene.pdf|black bear relocation as a method to reduce elk calf predation within great smoky mountains national park|thesis|joseph gene yarkovich|may|2009
ZemmelYekaterinaMikhailovna.pdf|carefully guarded borders|thesis|yekaterina mikhailovna zemmel|may|2009
ZhouFujun.pdf|the role of a translation initiation factor subunit, eif3h, in arabidopsis shoot apical meristem maintenance and auxin response|dissertation|fujun zhou|may|2009
MayesRichardThomas.pdf|the synthesis and characterization of building block-based titanosilicates and their activity toward alcohol dehydration/dehydrogenation reactions|dissertation||may|2009
